{
  "$schema": "https://json-schema.org/draft/2020-12/schema",
  "title": "Video Testcase Output Schema",
  "type": "object",
  "required": [
    "testcase_id",
    "core_intent",
    "duration_seconds",
    "story_logic",
    "shot_plan",
    "final_video_prompt",
    "negative_prompt",
    "coverage_notes"
  ],
  "properties": {
    "testcase_id": {"type": "string"},
    "core_intent": {"type": "string", "minLength": 10},
    "duration_seconds": {"type": "integer", "minimum": 10, "maximum": 15},
    "story_logic": {"type": "string", "minLength": 20},
    "shot_plan": {
      "type": "array",
      "minItems": 1,
      "maxItems": 5,
      "items": {
        "type": "object",
        "required": [
          "shot_id",
          "time_range",
          "visual_goal",
          "what_happens",
          "camera_and_framing",
          "lighting_and_mood"
        ],
        "properties": {
          "shot_id": {"type": "integer", "minimum": 1},
          "time_range": {"type": "string"},
          "visual_goal": {"type": "string"},
          "what_happens": {"type": "string"},
          "camera_and_framing": {"type": "string"},
          "lighting_and_mood": {"type": "string"}
        },
        "additionalProperties": false
      }
    },
    "final_video_prompt": {"type": "string", "minLength": 30},
    "negative_prompt": {"type": "string", "minLength": 10},
    "coverage_notes": {
      "type": "object",
      "required": ["must_show", "soft_interpretations", "tradeoffs"],
      "properties": {
        "must_show": {"type": "array", "items": {"type": "string"}},
        "soft_interpretations": {"type": "array", "items": {"type": "string"}},
        "tradeoffs": {"type": "array", "items": {"type": "string"}}
      },
      "additionalProperties": false
    }
  },
  "additionalProperties": false
}
